use test;
create table t_mv_txn_66385 (a int not null, b int not null);
insert into t_mv_txn_66385 values (1, 10), (1, 5), (2, 7);
create materialized view log on t_mv_txn_66385 (a, b) purge next date_add(now(), interval 1 hour);
create materialized view mv_txn_66385 (a, s, cnt) refresh fast next date_add(now(), interval 1 hour) as
select a, sum(b), count(1) from t_mv_txn_66385 group by a;
refresh materialized view mv_txn_66385 with async mode complete in place;
Error 1105 (HY000): refresh materialized view: WITH ASYNC MODE is not supported yet
begin;
refresh materialized view mv_txn_66385 complete in place;
Error 1105 (HY000): cannot run REFRESH MATERIALIZED VIEW in explicit transaction
rollback;
prepare stmt from "refresh materialized view mv_txn_66385 complete in place";
begin;
execute stmt;
Error 1105 (HY000): cannot run REFRESH MATERIALIZED VIEW in explicit transaction
rollback;
deallocate prepare stmt;
set autocommit = 0;
select @@tidb_current_ts = 0;
@@tidb_current_ts = 0
1
refresh materialized view mv_txn_66385 complete in place;
select @@tidb_current_ts = 0;
@@tidb_current_ts = 0
1
insert into t_mv_txn_66385 values (3, 4);
select @@tidb_current_ts > 0;
@@tidb_current_ts > 0
1
refresh materialized view mv_txn_66385 complete in place;
Error 1105 (HY000): cannot run REFRESH MATERIALIZED VIEW in explicit transaction
rollback;
set autocommit = 1;
drop materialized view mv_txn_66385;
drop materialized view log on t_mv_txn_66385;
drop table if exists t_mv_txn_66385;
create table t_mv_inc_67017 (a int not null, b int not null);
insert into t_mv_inc_67017 values (1, 10), (1, 5), (2, 7);
create materialized view log on t_mv_inc_67017 (a, b) purge next date_add(now(), interval 1 hour);
create materialized view mv_inc_67017 (a, s, cnt) refresh fast next date_add(now(), interval 1 hour) as
select a, sum(b), count(1) from t_mv_inc_67017 group by a;
select * from mv_inc_67017 order by a;
a	s	cnt
1	15	2
2	7	1
insert into t_mv_inc_67017 values (2, 3), (3, 4);
refresh materialized view mv_inc_67017 complete delta apply;
select * from mv_inc_67017 order by a;
a	s	cnt
1	15	2
2	10	2
3	4	1
drop materialized view mv_inc_67017;
drop materialized view log on t_mv_inc_67017;
drop table if exists t_mv_inc_67017;
create table t_mv_mlog_refresh (a int not null, b int not null);
insert into t_mv_mlog_refresh values (1, 10), (1, 5), (2, 7);
create materialized view log on t_mv_mlog_refresh (a, b) purge next date_add(now(), interval 1 hour);
create materialized view mv_mlog_refresh (a, s, cnt) refresh fast as
select a, sum(b), count(1) from t_mv_mlog_refresh group by a;
create materialized view log on mv_mlog_refresh (a, s, cnt);
update t_mv_mlog_refresh set b = 11 where a = 1 and b = 10;
delete from t_mv_mlog_refresh where a = 2;
insert into t_mv_mlog_refresh values (3, 4);
refresh materialized view mv_mlog_refresh fast;
update t_mv_mlog_refresh set b = 12 where a = 1 and b = 11;
delete from t_mv_mlog_refresh where a = 3;
insert into t_mv_mlog_refresh values (4, 8);
refresh materialized view mv_mlog_refresh complete delta apply;
select a, s, cnt, `_MLOG$_DML_TYPE`, `_MLOG$_OLD_NEW`
from `$mlog$mv_mlog_refresh`
order by a, `_MLOG$_DML_TYPE`, `_MLOG$_OLD_NEW`, s;
a	s	cnt	_MLOG$_DML_TYPE	_MLOG$_OLD_NEW
1	15	2	U	-1
1	16	2	U	-1
1	16	2	U	1
1	17	2	U	1
2	7	1	D	-1
3	4	1	D	-1
3	4	1	I	1
4	8	1	I	1
drop materialized view log on mv_mlog_refresh;
drop materialized view mv_mlog_refresh;
drop materialized view log on t_mv_mlog_refresh;
drop table if exists t_mv_mlog_refresh;
create table t_nested_mv_refresh (a int not null, b int not null, v int not null);
insert into t_nested_mv_refresh values (1, 1, 10), (1, 1, 5), (1, 2, 7), (2, 1, 4);
create materialized view log on t_nested_mv_refresh (a, b, v);
create materialized view mv_nested_parent (a, b, s, cnt) refresh fast as
select a, b, sum(v), count(1) from t_nested_mv_refresh group by a, b;
create materialized view log on mv_nested_parent (a, b, s, cnt);
create materialized view mv_nested_child (a, s, cnt, cnt_s) refresh fast as
select a, sum(s), count(1), count(s) from mv_nested_parent group by a;
select a, s, cnt, cnt_s from mv_nested_child order by a;
a	s	cnt	cnt_s
1	22	2	2
2	4	1	1
update t_nested_mv_refresh set v = 11 where a = 1 and b = 1 and v = 10;
delete from t_nested_mv_refresh where a = 1 and b = 2;
insert into t_nested_mv_refresh values (3, 1, 8);
refresh materialized view mv_nested_parent fast;
refresh materialized view mv_nested_child fast;
select a, s, cnt, cnt_s from mv_nested_child order by a;
a	s	cnt	cnt_s
1	16	1	1
2	4	1	1
3	8	1	1
update t_nested_mv_refresh set v = 12 where a = 1 and b = 1 and v = 11;
delete from t_nested_mv_refresh where a = 3 and b = 1;
insert into t_nested_mv_refresh values (4, 1, 9);
refresh materialized view mv_nested_parent complete delta apply;
refresh materialized view mv_nested_child fast;
select a, s, cnt, cnt_s from mv_nested_child order by a;
a	s	cnt	cnt_s
1	17	1	1
2	4	1	1
4	9	1	1
drop materialized view mv_nested_child;
drop materialized view log on mv_nested_parent;
drop materialized view mv_nested_parent;
drop materialized view log on t_nested_mv_refresh;
drop table if exists t_nested_mv_refresh;
create table t_mv_ddl_70457 (a int not null, b int not null);
insert into t_mv_ddl_70457 values (1, 10), (1, 5), (2, 7);
create materialized view log on t_mv_ddl_70457 (a, b) purge next date_add(now(), interval 1 hour);
create materialized view mv_ddl_70457 (a, s, cnt) refresh fast next date_add(now(), interval 1 hour) as
select a, sum(b), count(1) from t_mv_ddl_70457 group by a;
create index idx_a on mv_ddl_70457 (a);
drop index idx_a on mv_ddl_70457;
create index idx_expr on mv_ddl_70457 ((a + 1));
Error 8200 (HY000): Unsupported ADD INDEX on materialized view table that changes writable columns
alter table mv_ddl_70457 add index idx_expr2 ((a + 1));
Error 8200 (HY000): Unsupported ADD INDEX on materialized view table that changes writable columns
desc mv_ddl_70457;
Field	Type	Null	Key	Default	Extra
a	int	NO	PRI	NULL	
s	decimal(32,0)	YES		NULL	
cnt	bigint	NO		NULL	
drop materialized view mv_ddl_70457;
drop materialized view log on t_mv_ddl_70457;
drop table if exists t_mv_ddl_70457;
